{
  "id": "decision-fallback-absent",
  "description": "An ordinary answer carries neither fallback header: Decision.fallback is empty.",
  "call": {
    "method": "decide",
    "args": {
      "state": "I was charged twice.",
      "questions": {
        "route": {
          "$choice": {
            "instructions": "Where should this go?",
            "options": [
              "billing",
              "bug"
            ]
          }
        }
      },
      "model": "decisionnode-moe"
    }
  },
  "response": {
    "status": 200,
    "headers": {
      "content-type": "application/json",
      "x-request-id": "req_case_0001",
      "x-decisionnode-model": "decisionnode-moe-0.9.0-rc1"
    },
    "body_text": "{\"model\": \"decisionnode-moe-0.9.0-rc1\", \"answers\": {\"route\": {\"type\": \"choice\", \"choice\": \"billing\", \"confidence\": 0.62, \"probabilities\": {\"billing\": 0.81, \"bug\": 0.19}}}, \"usage\": {\"input_tokens\": 31, \"output_tokens\": 0}}"
  },
  "expect": {
    "decision": {
      "model": "decisionnode-moe-0.9.0-rc1",
      "fallback": null
    }
  }
}
