{
  "id": "collections-deleted",
  "description": "A delete answers {id, deleted: true}.",
  "call": {
    "method": "collections.delete",
    "args": {
      "collection_id": "col_3f6c1a9e0b2d4c7f8a1e5d9b2c4f6a80"
    }
  },
  "response": {
    "status": 200,
    "headers": {
      "content-type": "application/json",
      "x-request-id": "req_case_0001"
    },
    "body_text": "{\"id\": \"col_3f6c1a9e0b2d4c7f8a1e5d9b2c4f6a80\", \"deleted\": true}"
  },
  "expect": {
    "deleted": {
      "id": "col_3f6c1a9e0b2d4c7f8a1e5d9b2c4f6a80",
      "deleted": true
    }
  }
}
