{
  "id": "collection-object",
  "description": "A collection: id, type, name, public, items (the count now), created_at and deletion, null when nothing is marked, kept as sent.",
  "call": {
    "method": "collections.get",
    "args": {
      "collection_id": "col_3f6c1a9e0b2d4c7f8a1e5d9b2c4f6a80"
    }
  },
  "response": {
    "status": 200,
    "headers": {
      "content-type": "application/json",
      "x-request-id": "req_case_0001"
    },
    "body_text": "{\"id\": \"col_3f6c1a9e0b2d4c7f8a1e5d9b2c4f6a80\", \"type\": \"face\", \"name\": \"Staff, Stockholm office\", \"public\": false, \"items\": 412, \"created_at\": \"2026-10-12T09:00:00Z\", \"deletion\": null}"
  },
  "expect": {
    "collection": {
      "id": "col_3f6c1a9e0b2d4c7f8a1e5d9b2c4f6a80",
      "type": "face",
      "name": "Staff, Stockholm office",
      "public": false,
      "items": 412,
      "created_at": "2026-10-12T09:00:00Z",
      "deletion": null
    }
  }
}
