{
  "id": "safety-unchecked",
  "description": "When the check did not run the header is unchecked with a reason code.",
  "call": {
    "method": "decide",
    "args": {
      "state": "s",
      "questions": {
        "one": {
          "$choice": {
            "instructions": "?",
            "options": [
              "only"
            ]
          }
        }
      }
    }
  },
  "response": {
    "status": 200,
    "headers": {
      "content-type": "application/json",
      "x-request-id": "req_7c1e0a5b2d9f4e8a",
      "x-decisionnode-model": "decisionnode-moe-0.9.0-rc1",
      "x-decisionnode-latency-ms": "23",
      "x-decisionnode-safety": "unchecked;reason=\"no-model-question\""
    },
    "body_text": "{\"model\": \"decisionnode-moe-0.9.0-rc1\", \"answers\": {\"one\": {\"type\": \"choice\", \"choice\": \"only\", \"confidence\": 1.0, \"probabilities\": {\"only\": 1.0}}}, \"usage\": {\"input_tokens\": 9, \"output_tokens\": 0}}"
  },
  "expect": {
    "decision": {
      "safety": {
        "checked": false,
        "reason": "no-model-question"
      }
    }
  }
}
