{
  "id": "usage-key-object",
  "description": "One key's usage: the key (id, name, scope, device_id, labels, status, created_at, revoked_at, expires_at), the period applied, as_of, totals (requests, free_tier_requests, input_tokens, image_tokens, video_tokens, booster_calls, cost with usd, model_usd and boosters_usd) and, as asked, buckets and by_model, each with its totals. Kept as sent.",
  "call": {
    "method": "usage.key",
    "args": {
      "key_id": "key_00000000000000000000000000000d01",
      "start": "2026-09-01T00:00:00Z",
      "end": "2026-10-01T00:00:00Z",
      "granularity": "day",
      "group_by": "model"
    }
  },
  "response": {
    "status": 200,
    "headers": {
      "content-type": "application/json",
      "x-request-id": "req_case_0001",
      "cache-control": "private, no-store"
    },
    "body_text": "{\"key\": {\"id\": \"key_00000000000000000000000000000d01\", \"name\": \"Drone 1\", \"scope\": \"decide\", \"device_id\": \"drone-1\", \"labels\": {\"customer\": \"acme\", \"plan\": \"pro\"}, \"status\": \"active\", \"created_at\": \"2026-08-20T08:00:00Z\", \"revoked_at\": null, \"expires_at\": null}, \"period\": {\"start\": \"2026-09-01T00:00:00Z\", \"end\": \"2026-10-01T00:00:00Z\"}, \"as_of\": \"2026-10-01T00:00:00Z\", \"totals\": {\"requests\": 10, \"free_tier_requests\": 4, \"input_tokens\": 7400, \"image_tokens\": 1200, \"video_tokens\": 0, \"booster_calls\": 1, \"cost\": {\"usd\": 0.024213, \"model_usd\": 0.000213, \"boosters_usd\": 0.024}}, \"buckets\": [{\"start\": \"2026-09-03T00:00:00Z\", \"end\": \"2026-09-04T00:00:00Z\", \"totals\": {\"requests\": 5, \"free_tier_requests\": 0, \"input_tokens\": 5000, \"image_tokens\": 1200, \"video_tokens\": 0, \"booster_calls\": 1, \"cost\": {\"usd\": 0.024185, \"model_usd\": 0.000185, \"boosters_usd\": 0.024}}}, {\"start\": \"2026-09-04T00:00:00Z\", \"end\": \"2026-09-05T00:00:00Z\", \"totals\": {\"requests\": 5, \"free_tier_requests\": 4, \"input_tokens\": 2400, \"image_tokens\": 0, \"video_tokens\": 0, \"booster_calls\": 0, \"cost\": {\"usd\": 2.8e-05, \"model_usd\": 2.8e-05, \"boosters_usd\": 0.0}}}], \"by_model\": [{\"model\": \"decisionnode-flash-0.9.0-rc1\", \"totals\": {\"requests\": 5, \"free_tier_requests\": 4, \"input_tokens\": 2400, \"image_tokens\": 0, \"video_tokens\": 0, \"booster_calls\": 0, \"cost\": {\"usd\": 2.8e-05, \"model_usd\": 2.8e-05, \"boosters_usd\": 0.0}}}, {\"model\": \"decisionnode-moe-0.9.0-rc1\", \"totals\": {\"requests\": 5, \"free_tier_requests\": 0, \"input_tokens\": 5000, \"image_tokens\": 1200, \"video_tokens\": 0, \"booster_calls\": 1, \"cost\": {\"usd\": 0.024185, \"model_usd\": 0.000185, \"boosters_usd\": 0.024}}}]}"
  },
  "expect": {
    "key_usage": {
      "key": {
        "id": "key_00000000000000000000000000000d01",
        "name": "Drone 1",
        "scope": "decide",
        "device_id": "drone-1",
        "labels": {
          "customer": "acme",
          "plan": "pro"
        },
        "status": "active",
        "created_at": "2026-08-20T08:00:00Z",
        "revoked_at": null,
        "expires_at": null
      },
      "period": {
        "start": "2026-09-01T00:00:00Z",
        "end": "2026-10-01T00:00:00Z"
      },
      "as_of": "2026-10-01T00:00:00Z",
      "totals": {
        "requests": 10,
        "free_tier_requests": 4,
        "input_tokens": 7400,
        "image_tokens": 1200,
        "video_tokens": 0,
        "booster_calls": 1,
        "cost": {
          "usd": 0.024213,
          "model_usd": 0.000213,
          "boosters_usd": 0.024
        }
      },
      "buckets": [
        {
          "start": "2026-09-03T00:00:00Z",
          "end": "2026-09-04T00:00:00Z",
          "totals": {
            "requests": 5,
            "free_tier_requests": 0,
            "input_tokens": 5000,
            "image_tokens": 1200,
            "video_tokens": 0,
            "booster_calls": 1,
            "cost": {
              "usd": 0.024185,
              "model_usd": 0.000185,
              "boosters_usd": 0.024
            }
          }
        },
        {
          "start": "2026-09-04T00:00:00Z",
          "end": "2026-09-05T00:00:00Z",
          "totals": {
            "requests": 5,
            "free_tier_requests": 4,
            "input_tokens": 2400,
            "image_tokens": 0,
            "video_tokens": 0,
            "booster_calls": 0,
            "cost": {
              "usd": 2.8e-05,
              "model_usd": 2.8e-05,
              "boosters_usd": 0.0
            }
          }
        }
      ],
      "by_model": [
        {
          "model": "decisionnode-flash-0.9.0-rc1",
          "totals": {
            "requests": 5,
            "free_tier_requests": 4,
            "input_tokens": 2400,
            "image_tokens": 0,
            "video_tokens": 0,
            "booster_calls": 0,
            "cost": {
              "usd": 2.8e-05,
              "model_usd": 2.8e-05,
              "boosters_usd": 0.0
            }
          }
        },
        {
          "model": "decisionnode-moe-0.9.0-rc1",
          "totals": {
            "requests": 5,
            "free_tier_requests": 0,
            "input_tokens": 5000,
            "image_tokens": 1200,
            "video_tokens": 0,
            "booster_calls": 1,
            "cost": {
              "usd": 0.024185,
              "model_usd": 0.000185,
              "boosters_usd": 0.024
            }
          }
        }
      ]
    }
  }
}
