{
  "id": "decision-cost-absent",
  "description": "An answer without usage.cost (from a server that does not send it) still parses: cost is empty, never zeros.",
  "call": {
    "method": "decide",
    "args": {
      "state": "I was charged twice.",
      "questions": {
        "refund": {
          "$truth": {
            "instructions": "Is a refund asked for?"
          }
        }
      }
    }
  },
  "response": {
    "status": 200,
    "headers": {
      "content-type": "application/json",
      "x-request-id": "req_case_0001",
      "x-decisionnode-model": "decisionnode-moe-0.9.0-rc1"
    },
    "body_text": "{\"model\": \"decisionnode-moe-0.9.0-rc1\", \"answers\": {\"refund\": {\"type\": \"truth\", \"truth\": 0.94}}, \"usage\": {\"input_tokens\": 62, \"output_tokens\": 0}}"
  },
  "expect": {
    "decision": {
      "model": "decisionnode-moe-0.9.0-rc1",
      "usage": {
        "cost": null,
        "input_tokens": 62
      }
    }
  }
}
