{
  "id": "collections-enrolled-item-metadata",
  "description": "An enrollment's answer carries the item's metadata as sent, its numbers, texts and booleans as they are.",
  "call": {
    "method": "collections.enroll",
    "args": {
      "collection_id": "col_3f6c1a9e0b2d4c7f8a1e5d9b2c4f6a80",
      "image": {
        "$image": {
          "id": "badge",
          "url": "https://files.example.com/badges/emp-1042.jpg"
        }
      },
      "reference": "emp-1042",
      "label": "Reception",
      "metadata": {
        "department": "Reception",
        "badge_level": 2,
        "visitor": false
      }
    }
  },
  "response": {
    "status": 201,
    "headers": {
      "content-type": "application/json",
      "x-request-id": "req_case_0001"
    },
    "body_text": "{\"id\": \"itm_9a0b1c2d3e4f5a6b7c8d9e0f1a2b3c4d\", \"collection\": \"col_3f6c1a9e0b2d4c7f8a1e5d9b2c4f6a80\", \"reference\": \"emp-1042\", \"label\": \"Reception\", \"metadata\": {\"department\": \"Reception\", \"badge_level\": 2, \"visitor\": false}, \"faces_found\": 1, \"box\": {\"x1\": 412, \"y1\": 220, \"x2\": 580, \"y2\": 470}, \"created_at\": \"2026-10-12T09:00:00Z\", \"usage\": {\"enrollments\": 1, \"cost\": {\"usd\": 0.001}}}"
  },
  "expect": {
    "item": {
      "id": "itm_9a0b1c2d3e4f5a6b7c8d9e0f1a2b3c4d",
      "collection": "col_3f6c1a9e0b2d4c7f8a1e5d9b2c4f6a80",
      "reference": "emp-1042",
      "label": "Reception",
      "metadata": {
        "department": "Reception",
        "badge_level": 2,
        "visitor": false
      },
      "faces_found": 1,
      "box": {
        "x1": 412,
        "y1": 220,
        "x2": 580,
        "y2": 470
      },
      "created_at": "2026-10-12T09:00:00Z",
      "usage": {
        "enrollments": 1,
        "cost": {
          "usd": 0.001
        }
      }
    }
  }
}
