{
  "id": "usage-absent",
  "description": "A body without usage gives empty input_tokens and output_tokens, never 0.",
  "call": {
    "method": "decide",
    "args": {
      "state": "s",
      "questions": {
        "q": {
          "$truth": {
            "instructions": "?"
          }
        }
      }
    }
  },
  "response": {
    "status": 200,
    "headers": {
      "content-type": "application/json",
      "x-request-id": "req_7c1e0a5b2d9f4e8a",
      "x-decisionnode-model": "decisionnode-moe-0.9.0-rc1",
      "x-decisionnode-latency-ms": "23",
      "x-decisionnode-safety": "harm=0.031, self_harm=0.004"
    },
    "body_text": "{\"model\": \"decisionnode-moe-0.9.0-rc1\", \"answers\": {\"q\": {\"type\": \"truth\", \"truth\": 0.5}}}"
  },
  "expect": {
    "decision": {
      "usage": {
        "input_tokens": null,
        "output_tokens": null
      },
      "latency_ms": 23
    }
  }
}
